,0
JoeJackson,"David Ian ""Joe"" Jackson (born 11 August 1954) is an English musician and singer-songwriter. Having spent years studying music and playing clubs, Jackson scored a hit with his first release, ""Is She Really Going Out with Him?"", in 1979. This was followed by a number of new wave singles before he moved to more jazz-inflected pop music and had a Top 10 hit in 1982 with ""Steppin' Out"". He is associate"
JoeWalsh,"Joseph Fidler Walsh (born November 20, 1947) is an American rock guitarist, singer, and songwriter. In a career spanning more than 50 years, he has been a member of three successful rock bands: James Gang, Eagles, and Ringo Starr & His All-Starr Band. Walsh was also part of the New Zealand band Herbs. In the 1990s, he was a member of the short-lived supergroup The Best.
Walsh has also experienced "
JohnFogerty,"John Cameron Fogerty (born May 28, 1945) is an American musician, singer, and songwriter. Together with Doug Clifford, Stu Cook, and his brother Tom Fogerty, he founded the band Creedence Clearwater Revival (""CCR""), for which he was the lead singer, lead guitarist, and principal songwriter. The group had nine top-10 singles and eight gold albums between 1968 and 1972, and was inducted into the Roc"
JohnFred,"John Fred Gourrier (May 8, 1941 – April 14, 2005), known by his stage name John Fred, was an American blue-eyed soul, swamp pop, rock and roll, and R&B performer from Baton Rouge, Louisiana, best known for the 1967 hit song ""Judy in Disguise (With Glasses)"".


== Early life ==
John Fred was born on May 8, 1941 in Baton Rouge, the son of John Fred Gourrier, Sr., and Miriam Chaisson. He had one sist"
JohnLennon,"John Winston Ono Lennon  (born John Winston Lennon, 9 October 1940 – 8 December 1980) was an English singer, songwriter, actor and peace activist who gained worldwide fame as the founder, co-lead vocalist, and rhythm guitarist of the Beatles. His songwriting partnership with Paul McCartney remains the most successful in musical history. In 1969, he started the Plastic Ono Band with his second wife"
JohnMellencamp,"John J. Mellencamp (born October 7, 1951), previously known as Johnny Cougar, John Cougar, and John Cougar Mellencamp, is an American musician, singer-songwriter, painter, actor, and film director. He is known for his catchy, populist brand of heartland rock, which emphasizes traditional instrumentation. Mellencamp rose to fame in the 1980s while ""honing an almost startlingly plainspoken writing s"
JohnnyHorton,"John LaGale Horton (April 30, 1925 – November 5, 1960) was an American country music, honky tonk and rockabilly singer and musician, during the 1950s and early 1960s, best known for his saga songs that became international hits beginning with the 1959 single ""The Battle of New Orleans"", which was awarded the 1960 Grammy Award for Best Country & Western Recording. The song was awarded the Grammy Ha"
JohnnyMathis,"John Royce Mathis (born September 30, 1935) is an American singer-songwriter of popular music. Starting his career with singles of standard music, he became highly popular as an album artist, with several dozen of his albums achieving gold or platinum status and 73 making the Billboard charts to date. Mathis has received the Grammy Lifetime Achievement Award and has been inducted into the Grammy H"
JohnnyNash,"John Lester Nash Jr. (born August 19, 1940) is an American reggae and pop music singer-songwriter, best known in the US for his 1972 hit, ""I Can See Clearly Now"". He was one of the first non-Jamaican singers to record reggae music in Kingston, Jamaica.


== Life and musical career ==
Born John Lester Nash Jr. in Houston, Texas, United States, Nash sang in the choir at Progressive New Hope Baptist "
JohnnyRivers,"Johnny Rivers (born John Henry Ramistella; November 7, 1942) is an American musician, singer, songwriter, and record producer. His repertoire includes pop, folk, blues, and old-time rock 'n' roll. Rivers charted during the 1960s and 1970s but remains best known for a string of hit singles between 1964 and 1968, among them ""Memphis"" (a Chuck Berry cover), ""Mountain of Love"" (a Harold Dorman cover),"
JohnPaulYoung,"John Inglis Young, OAM (born 21 June 1950), known professionally as John Paul Young, is a Scottish-born Australian pop singer who had his 1978 worldwide hit with ""Love Is in the Air"". His career was boosted by regular appearances as a performer and guest host on national broadcaster, ABC's 1974–1987 TV series, Countdown.
Besides ""Love Is in the Air"", Young had top ten chart success in Germany and "
JohnWaite,"John Charles Waite (born 4 July 1952) is an English musician. As a solo artist, he has released ten studio albums and is best known for the 1984 hit single ""Missing You"", which reached No. 1 on the US Billboard Hot 100 and the top ten on the UK Singles Chart. He was also the lead vocalist for the successful rock bands The Babys and Bad English.


== Career ==
Waite was born in Lancaster, Lancashir"
JoniMitchell,"Roberta Joan ""Joni"" Mitchell  (née Anderson; born November 7, 1943) is a Canadian singer-songwriter. Drawing from folk, pop, rock, and jazz, Mitchell's songs often reflect social and environmental ideals as well as her feelings about romance, confusion, disillusionment, and joy. She has received many accolades, including nine Grammy Awards and induction into the Rock and Roll Hall of Fame in 1997."
JoseFeliciano,"José Monserrate Feliciano García (born September 10, 1945), better known simply as José Feliciano [xoˈse feliˈsjano], is a Puerto Rican musician, singer and composer, best known for many international hits, including his rendition of The Doors' ""Light My Fire"" and the best-selling Christmas single, ""Feliz Navidad."" His music is known for its fusion of styles: Latin, jazz, blues, soul and even rock"
Journey,"Journey is an American rock band that formed in San Francisco in 1973, composed of former members of Santana and Frumious Bandersnatch. The band has gone through several phases; its strongest commercial success occurred between 1978 and 1987 when Steve Perry was lead vocalist. During that period, the band released a series of hit songs, including ""Don't Stop Believin'"" (1981), which in 2009 became"
JulianLennon,"John Charles Julian Lennon (born 8 April 1963) is an English singer, musician, photographer and philanthropist. He is the founder of the White Feather Foundation.
He is the son of The Beatles member John Lennon and his first wife, Cynthia, and was the direct inspiration for three Beatles' songs: ""Lucy in the Sky with Diamonds"" (1967), ""Hey Jude"" (1968), and ""Good Night"" (1968). His parents divorce"
JuniorWalker,"Autry DeWalt Mixon Jr. (June 14, 1931 – November 23, 1995), known professionally as Junior Walker, was an American multi-instrumentalist (primarily saxophonist and vocalist) who recorded for Motown during the 1960s. He also performed as a session and live-performing saxophonist with the band Foreigner during the 1980s.


== Early life ==
Walker was born Autry DeWalt Mixon Jr. on June 14, 1931 in B"
Kansas,"Kansas is an American rock band that became popular in the 1970s initially on album-oriented rock charts and later with hit singles such as ""Carry On Wayward Son"" and ""Dust in the Wind"". The band has produced nine gold albums, three multi-platinum albums (Leftoverture 6x, Point of Know Return 4x, The Best of Kansas 4x), one other platinum studio album (Monolith), one platinum live double album (Tw"
KateBush,"Catherine Bush  (born 30 July 1958) is an English singer, songwriter, musician, and record producer. In 1978, aged 19, she topped the UK Singles Chart for four weeks with her debut single ""Wuthering Heights"", becoming the first female artist to achieve a UK number one with a self-written song. She has since released 25 UK Top 40 singles, including the Top 10 hits ""The Man with the Child in His Eye"
KatrinaAndTheWaves,"Katrina and the Waves were a British-American rock band best known for the 1985 hit ""Walking on Sunshine"". They also won the 1997 Eurovision Song Contest with the song ""Love Shine a Light"".


== History ==


=== Pre-history (1975–80) ===
The band's earliest incarnation was as The Waves, a group that played in and around Cambridge, England, from 1975 to 1977. The Waves featured guitarist Kimberley "
KDLang,"Kathryn Dawn Lang  (born November 2, 1961), known by her stylized stage name k.d. lang, is a Canadian pop and country singer-songwriter and occasional actress.
Lang has won both Juno Awards and Grammy Awards for her musical performances; hits include ""Constant Craving"" and ""Miss Chatelaine"". She has contributed songs to movie soundtracks and has collaborated with musicians such as Roy Orbison, Ton"
Kenny,"Billy Stephen Kenny is a British DJ. Billy is based between Leeds UK, Los Angeles California and Hannover Germany where his co-owned record label, This Ain’t Bristol, is headquartered.On April 2, 2018, Kenny was arrested for possessing liquid marijuana; his U.S.A visa was revoked and many shows were cancelled.


== Discography ==


=== Compilations ===
Billy Kenny Selections (This Ain't Bristol,20"
KennyG,"Kenny is a surname, a given name, and a diminutive of several different given names.
In Ireland, the surname is an Anglicisation of the Irish Ó Cionnaith, also spelt Ó Cionnaoith and Ó Cionaodha, meaning ""descendant of Cionnaith"". It was once popular in the 16th-century in Leinster, Munster, parts of Connacht and in County Tyrone, Ulster. It was Anglicised as O'Kenna, O'Kenny, O'Kinney, Kenna, Ken"
KennyLoggins,"Kenneth Clark Loggins (born January 7, 1948) is an American singer-songwriter and guitarist. His early songs were recorded with the Nitty Gritty Dirt Band in 1970, which led to seven albums recorded as Loggins and Messina from 1972 to 1977. As a solo artist, Loggins experienced a string of soundtrack successes, including an Academy Award nomination for ""Footloose"" in 1984. His early soundtrack con"
KennyRogers,"Kenneth Ray Rogers (August 21, 1938 – March 20, 2020) was an American singer, songwriter, actor, record producer, and entrepreneur. He was elected to the Country Music Hall of Fame in 2013. Rogers was particularly popular with country audiences but also charted more than 120 hit singles across various music genres, and topped the country and pop album charts for more than 200 individual weeks in t"
KimCarnes,"Kim Carnes  (born July 20, 1945) is an American singer-songwriter. Born and raised in Los Angeles, California, she began her career as a songwriter in the 1960s, writing for other artists while performing in local clubs and working as a session background singer with the famed Waters sisters (featured in the documentary 20 Feet from Stardom). After she signed her first publishing deal with Jimmy B"
KingHarvest,"King Harvest was a 1970s French-American rock band that was formed initially in Ithaca, New York and then migrated to Paris, known for their 1972 hit single, ""Dancing in the Moonlight"".


== History ==


=== Background and founding of the group ===
Formed by a group of four American expatriates in Paris in 1970, King Harvest was best known for its one U.S. hit single, ""Dancing in the Moonlight"", w"
Kiss,"Kiss (often stylized as KIϟϟ) is an American rock band formed in New York City in January 1973 by Paul Stanley, Gene Simmons, Peter Criss, and Ace Frehley. Well known for its members' face paint and stage outfits, the group rose to prominence in the mid-to-late 1970s with its elaborate live performances, which featured fire breathing, blood-spitting, smoking guitars, shooting rockets, levitating d"
KoolAndTheGang,"Kool & the Gang is an American band formed in Jersey City, New Jersey, in 1964 by brothers Robert ""Kool"" Bell and Ronald Bell, with Dennis ""D.T."" Thomas, Robert ""Spike"" Mickens, Charles Smith, George Brown, and Ricky West. They have undergone numerous changes in personnel and have explored many musical styles throughout their history, including jazz, soul, funk, rock, and pop music. After settling"
Kraftwerk,"The discography of German electronic band Kraftwerk consists of 10 studio albums, two live albums, one remix album and 26 singles. Formed by Ralf Hütter and Florian Schneider in Düsseldorf in 1970, Kraftwerk were part of the krautrock scene. However, the group mostly found fame as pioneers of electronic music, showcasing their styles on a series of concept albums.
While their initial albums featur"
Labelle,"Labelle was an American all-female singing group who were a popular vocal group of the 1960s and 1970s. The group was formed after the disbanding of two rival girl groups in the area around Philadelphia and Trenton, the Ordettes and the Del-Capris, forming as a new version of the former group, then later changing their name to the Blue Belles (later Bluebelles). The founding members were Patti LaB"
LauraBrannigan,"Laura Ann Branigan (July 3, 1952 – August 26, 2004) was an American singer, songwriter, and actress. Her signature song, the platinum-certified 1982 single ""Gloria"", stayed on the U.S. Billboard Hot 100 for 36 weeks, then a record for a female artist, peaking at No. 2. It also reached number one in Australia and Canada. In 1984, she reached number one in Canada and Germany with the U.S. No. 4 hit "
LedZeppelin,"The discography of the English rock band Led Zeppelin consists of eight studio albums, four live albums, nine compilation albums, sixteen singles and eight music downloads. Formed in London in 1968, the group consisted of guitarist Jimmy Page, singer Robert Plant, bassist John Paul Jones, and drummer John Bonham. The band pioneered the concept of album-oriented rock and often refused to release po"
LeftBanke,"The Left Banke was an American baroque pop band, formed in New York City in 1965. They are best remembered for their two U.S. hit singles, ""Walk Away Renée"" and ""Pretty Ballerina"". The band often used what the music press referred to as ""baroque"" string arrangements, which led to their music being variously termed as ""Bach-rock"" or ""baroque rock"". The band's vocal harmonies borrowed from contempor"
LeifGarrett,"Leif Garrett (born Leif Per Nervik; November 8, 1961) is an American singer, actor, and television personality. He worked as a child actor, then in the 1970s became famous as a teen idol in music. He later received much publicity for his drug abuse and legal troubles.


== Early life ==
Garrett was born in Hollywood, California, to Rik Nervik and actress Carolyn Stellar, and started his entertainm"
LemonPipers,"The Lemon Pipers were a 1960s American psychedelic rock band from Oxford, Ohio, United States, known chiefly for their song ""Green Tambourine"", which reached No. 1 in the United States in 1968. The song has been credited as being the first bubblegum pop chart-topper.The Lemon Pipers comprised drummer William E. Albaugh (1946–1999), guitarist Bill Bartlett (born 1946), vocalist Dale ""Ivan"" Browne ("
LeonRussell,"Leon Russell (born Claude Russell Bridges; April 2, 1942 – November 13, 2016) was an American musician and songwriter who was involved with numerous bestselling pop music records during his 60-year career. His genres included pop, country, rock, folk, gospel, bluegrass, rhythm and blues, folk rock, blues rock, surf, standards, and Tulsa Sound.His collaborations rank as some of the most successful "
LeoSayer,"Gerard Hugh ""Leo"" Sayer (born 21 May 1948) is an English-Australian singer-songwriter musician and entertainer whose singing career has spanned four decades. He is now an Australian citizen and resident.
Sayer launched his career in the United Kingdom in the early 1970s, and became a top singles and album act on both sides of the Atlantic in the 1970s. His first seven hit singles in the United Kin"
LesleyGore,"Lesley Sue Goldstein (May 2, 1946 – February 16, 2015), known professionally as Lesley Gore, was an American singer, songwriter, actress, and activist. At the age of 16 (in 1963) she recorded the pop hit ""It's My Party"" (a US number one), and followed it up with other hits including ""Judy's Turn to Cry"", ""She's a Fool"",  ""You Don't Own Me"", ""Maybe I Know"" and ""California Nights"".
Gore also worked "
Level42,"Level 42 are an English jazz-funk band formed on the Isle of Wight in 1979. They had a number of UK and worldwide hits during the 1980s and 1990s.
Their highest-charting single in the UK was ""Lessons in Love"", which reached number three on the UK Singles Chart, and number 12 on the US Billboard Hot 100 chart, upon its release in 1986. An earlier single, ""Something About You"", was their most succes"
LindaRonstadt,"The discography of Linda Ronstadt, an American rock, pop and country artist (who also recorded in other genres, such as light opera and traditional Mexican music), consists of 24 solo studio albums, one live album, numerous compilation albums, and 63 singles. After recording three albums with her folk rock band, The Stone Poneys, Ronstadt debuted on Capitol Records as a solo artist with 1969's Han"
LindseyBuckingham,"Lindsey Adams Buckingham (born October 3, 1949) is an American musician, singer, songwriter and producer, best known as lead guitarist and one of the vocalists of the music group Fleetwood Mac from 1975 to 1987 and 1997 to 2018. In addition to his tenure with Fleetwood Mac, Buckingham has released six solo albums and three live albums. As a member of Fleetwood Mac, he was inducted into the Rock an"
LionelRichie,"Lionel Brockman Richie Jr. (born June 20, 1949) is an American singer, songwriter, composer, multi-instrumentalist, record producer and actor. His recordings with the Commodores and in his solo career made him one of the most successful balladeers of the 1980s.
Beginning in 1968, Richie was a member of the funk and soul band the Commodores. The Commodores became established as a popular soul group"
LippsInc,"Lipps Inc. ( lip-sink) was an American disco and funk group from Minneapolis, Minnesota. The group was best known for the chart-topping 1980 worldwide hit single ""Funkytown"" which hit No. 1 in 28 different countries around the world and was certified as double-platinum in sales.The group originally consisted of lead vocalist Cynthia Johnson and a changing lineup of session musicians including guit"
LittleEva,"Eva Narcissus Boyd (June 29, 1943 – April 10, 2003), known by the stage name of Little Eva, was an American pop singer. Although some sources claim that her stage name was inspired by a character from the novel Uncle Tom's Cabin, she stated in an interview that she was named after her aunt, which prompted her family to call her ""Little Eva.""


== Biography ==
Boyd was born in Belhaven, North Carol"
LittleRichard,"Richard Wayne Penniman (December 5, 1932 – May 9, 2020), known as Little Richard, was an American musician, singer, and songwriter.  He was an influential figure in popular music and culture for seven decades. Nicknamed ""The Innovator, The Originator, and The Architect of Rock and Roll"", Richard's most celebrated work dates from the mid-1950s, when his charismatic showmanship and dynamic music, ch"
LittleRiverBand,"Little River Band (LRB) are a rock band originally formed in Melbourne, Australia, in March 1975. The band achieved commercial success in both Australia and the United States. They have sold more than 30 million records; six studio albums reached the top 10 on the Australian Kent Music Report albums chart including Diamantina Cocktail (April 1977) and First Under the Wire (July 1979), which both p"
Lobo,"Lobo (born 19 November 1973) is a Brazilian painter of Pop Art. He has already painted artworks for personalities such as Luciano Huck, Angélica, Sabrina Sato, and Michel Teló, among others. He has also participated in projects together with companies such as Heineken, Mercado Livre, and Viva Schin, among others.


== Biographical overview ==
Lobo was born on 19 November 1973. He has initiated his"
LogginsAndMessina,"Loggins and Messina is an American rock-pop duo consisting of Kenny Loggins and Jim Messina, who achieved their success in the early to mid-1970s. Among their well-known songs are ""Danny's Song"", ""House at Pooh Corner"", and ""Your Mama Don't Dance"". After selling more than 16 million records and becoming one of the leading musical duos of the 1970s, Loggins and Messina broke up in 1976. Although Me"
LondonBeat,"Londonbeat is a British-American dance-pop band who scored a number of pop and dance hits in the early 1990s. Band members are American Jimmy Helms (who also had a successful solo career and sang radio jingles for Radio Hallam and Hereward Radio in the UK); Jimmy Chambers (born 29 January 1946), from Trinidad, and Charles Pierre. Former members include multi-instrumentalist William Henshall (credi"
LosBravos,"Los Bravos were a Spanish beat group, formed in 1965 and based in Madrid. They are most well known for their debut single ""Black Is Black"" which reached No. 2 in the United Kingdom in July 1966 and No. 4 in the United States (the first Spanish group to do so), selling over a million records worldwide.


== Biography ==
The band was an amalgamation of two pop groups, Los Sonor from Madrid and The R"
LouisArmstrong,"Louis Daniel Armstrong (August 4, 1901 – July 6, 1971), nicknamed ""Satchmo"", ""Satch"", and ""Pops"", was an American trumpeter, composer, vocalist, and actor who was among the most influential figures in jazz. His career spanned five decades, from the 1920s to the 1960s, and different eras in the history of jazz. In 2017, he was inducted into the Rhythm & Blues Hall of Fame.
Armstrong was born and ra"
LouRawls,"Louis Allen Rawls (December 1, 1933 – January 6, 2006) was an American singer, songwriter, actor, voice actor, and record producer. Rawls released more than 60 albums, sold more than 40 million records, and had numerous charting singles, most notably his song ""You'll Never Find Another Love like Mine"". He worked as a film, television, and voice actor. He was also a three-time Grammy-winner, all fo"
LouReed,"Lewis Allan Reed (March 2, 1942 – October 27, 2013) was an American musician, singer, songwriter and poet. He was the guitarist, singer and principal songwriter for the rock band the Velvet Underground and had a solo career that spanned five decades. The Velvet Underground was not a commercial success during its existence, but became regarded as one of the most influential bands in the history of "
LoveAffair,"Hercules & Love Affair is a dance music project created by American DJ Andy Butler in 2004. Consisting of a rotating cast of performers and musicians, the band work within the genres of house music, disco, techno and nu-disco.
Originally based in New York City, now based in Ghent, Belgium, Hercules and Love Affair were founded following Butler's collaboration with Anohni to produce the song ""Blind"
Loverboy,"Loverboy was the debut album released by Canadian rock band Loverboy in 1980.


== Album cover ==
Barbara Astman was commissioned to create the album cover, and was sent a copy along with lyrics for the song ""Little Girl"". She created the cover by typing the lyrics from the song onto a self-portrait Polaroid as it developed.


== Critical reception ==
Allmusic gave the album a rave retrospective r"
LoveUnlimited,"Love Unlimited was a female vocal trio that provided backing vocals for American R&B/soul singer Barry White on his albums and concert tours. They also found success with their own recordings.


== Career ==
Formed in 1969, the group included Barry White's future wife, Glodean James, her sister, Linda James, and their cousin Diane Taylor (who died of cancer in Pomona, California on November 29, 19"
LovinSpoonful,"The Lovin' Spoonful is an American rock band which was popular during the mid-to late-1960s.  Founded in New York City in 1965 by lead-singer/songwriter John Sebastian and guitarist Zal Yanovsky, it is best known for a number of hits which include ""Summer in the City"", ""Do You Believe In Magic"", ""Did You Ever Have to Make Up Your Mind?"", and ""Daydream"".  The band was inducted into the Rock and Rol"
Lulu,"Lulu Kennedy-Cairns, OBE (born Marie McDonald McLaughlin Lawrie; 3 November 1948) is a Scottish singer, actress, television personality and businesswoman. She is noted for her powerful singing voice.She is internationally known, but especially by UK audiences in the 1960s. Later in her career she had hits internationally with ""To Sir with Love"" from the 1967 film of the same name and with the titl"
LutherIngram,"Luther Thomas Ingram (November 30, 1937 – March 19, 2007) was an American R&B and soul singer-songwriter.  His most successful record, ""(If Loving You Is Wrong) I Don't Want to Be Right"", reached no. 1 on the Billboard R&B chart and no. 3 on the Hot 100 in 1972.


== Life and career ==
Luther Thomas Ingram was born in Jackson, Tennessee on November 30, 1937. His family moved to Alton, Illinois in "
LynyrdSkynyrd,"Lynyrd Skynyrd is an American rock band formed in 1964 that was named after the group's mutual high school gym teacher Leonard Skinner.  The band has released many studio, live, and other albums, along with several singles and video discs.
The band has sold 28 million albums in the US since 1991 when Nielsen SoundScan started tracking sales, not including album sales for the band's first 17 years."
M,"Mathangi ""Maya"" Arulpragasam  (born 18 July 1975), known by her stage name M.I.A. (), is a British rapper, singer, songwriter, record producer, visual artist, and activist.  Combining elements of alternative, dance, electronic, hip hop, and world music, her early compositions relied heavily on the Roland MC-505 music sequencer and drum machine, whilst her later work marked an evolution in her soun"
