,0
ConnieFrancis,"Concetta Rosa Maria Franconero (December 12, 1937), better known as Connie Francis, is an American pop singer, former actress, and top-charting female vocalist of the late 1950s and early 1960s. Although her chart success waned in the second half of the 1960s, Francis remained a top concert draw.


== Biography ==


=== 1937–1955: Early life and first appearances ===
Francis was born to an Italian"
CoreyHart,"Corey Mitchell Hart (born May 31, 1962) is a Canadian singer-songwriter,  known for his hit singles ""Sunglasses at Night"" and ""Never Surrender"". He has sold over 16 million records worldwide and recorded nine US Billboard Top 40 hits. In Canada, 30 of Hart's recordings have been Top 40 hits, including 11 in the Top 10, over the course of over 35 years in the music industry. Nominated for the Gramm"
Cowsills,"The Cowsills are an American singing group from Newport, Rhode Island, six siblings noted for performing professionally and singing harmonies at an early age, later with their mother.
The band was formed in the spring of 1965 by brothers Bill, Bob, and Barry Cowsill; with their brother John joining shortly thereafter. Originally Bill and Bob played guitar and Barry played the drums. When John lear"
Cream,"Cream of Wheat is a brand of farina, a type of breakfast porridge mix made from wheat semolina. It looks similar to grits, but is smoother in texture since it is made with ground wheat kernels instead of ground corn. It was first manufactured in the United States in 1893 by wheat millers in Grand Forks, North Dakota. The product made its debut at the 1893 World's Columbian Exposition in Chicago, I"
CreedenceClearwaterRevival,"Creedence Clearwater Revival, also referred to as Creedence and CCR, was an American rock band which recorded and performed from 1968 to 1972. The band initially consisted of lead vocalist, lead guitarist, and primary songwriter John Fogerty; his brother, rhythm guitarist Tom Fogerty; bassist Stu Cook; and drummer Doug Clifford. These members had played together since 1959, first as the Blue Velve"
CrowsCounting,"Counting Crows is an American rock band from Berkeley, California, formed in 1991. The band consists of Adam Duritz (lead vocals), David Bryson (rhythm guitar), Charlie Gillingham (keyboards), Dan Vickrey (lead guitar), David Immerglück (guitars), Jim Bogios (drums) and Millard Powers (bass).Counting Crows gained popularity following the release of its debut album, August and Everything After (199"
CultureClub,"Culture Club is an English band that formed in London in 1981. The band comprises Boy George (lead vocals), Roy Hay (guitar and keyboards), Mikey Craig (bass guitar) and Jon Moss (drums and percussion). They are considered one of the most representative and influential groups of the 1980s.Led by singer and frontman Boy George, whose androgynous style of dressing caught the attention of the public "
CurtisLee,"Kelly Lee Curtis (born June 17, 1956) is an American actress. She is known for her roles in  Magic Sticks (1987), and The Devil's Daughter (1991).


== Early life ==
Kelly Curtis was born in Santa Monica, California, the eldest child of actors Tony Curtis and Janet Leigh. Her sister is actress Jamie Lee Curtis (born 1958). Her paternal grandparents were Hungarian-Jewish immigrants and two of her m"
CurtisMayfield,"Curtis Lee Mayfield (June 3, 1942 – December 26, 1999) was an American singer-songwriter, guitarist, and record producer, and one of the most influential musicians behind soul and politically conscious African-American music. He first achieved success and recognition with The Impressions during the civil rights movement of the late 1950s and 1960s, and later worked as a solo artist.
Born in Chicag"
CyndiLauper,"Cynthia Ann Stephanie Lauper (born June 22, 1953) is an American singer, songwriter, actress and activist. Her career has spanned over 40 years. Her album She's So Unusual (1983) was the first debut album by a female artist to achieve four top-five hits on the Billboard Hot 100—""Girls Just Want to Have Fun"", ""Time After Time"", ""She Bop"", and ""All Through the Night""—and earned Lauper the Best New A"
DanFogelberg,"Daniel Grayling Fogelberg (August 13, 1951 – December 16, 2007) was an American musician, songwriter, composer, and multi-instrumentalist. He is known for his 1980s songs, including ""Longer"" (1979), ""Same Old Lang Syne"" (1980), and ""Leader of the Band"" (1982).


== Early life and family ==
Dan Fogelberg was born in Peoria, Illinois. He was the youngest of three sons born to Margaret (née Irvine), "
DanHill,"Daniel Grafton Hill IV (born 3 June 1954) is a Canadian pop singer and songwriter. He had two major international hits with his songs ""Sometimes When We Touch"" and ""Can't We Try"", a duet with Vonda Shepard, as well as a number of other charting singles in Canada and the United States. He also established himself as a songwriter who produced hit songs for artists such as George Benson and Celine Di"
DannyAndTheJuniors,"Danny & the Juniors are an American doo-wop and rock and roll vocal group from Philadelphia, Pennsylvania originally consisting of Danny Rapp, Dave White, Frank Maffei and Joe Terranova. Formed in 1955, they are most widely recognized for their 1957 hit single ""At the Hop"".


== 1950s ==
Danny Rapp (lead), Frank Maffei (2nd tenor), Joe Terranova (baritone) (aka Joe Terry), and Dave White Tricker ("
DaveClarkFive,"The Dave Clark Five, often called The DC5, were an English rock and roll band formed in Tottenham in 1957. In January 1964 they had their first UK top ten single, ""Glad All Over"", which knocked the Beatles' ""I Want to Hold Your Hand"" off the top of the UK Singles Chart. It peaked at No. 6 in the United States in April 1964. Although this was their only UK No. 1, they topped the US chart in Decembe"
DaveEdmunds,"David William Edmunds (born 15 April 1944) is a Welsh singer/songwriter, guitarist, actor and record producer. Although he is mainly associated with pub rock and new wave, having many hits in the 1970s and early 1980s, his natural leaning has always been towards 1950s-style rock and roll.


== Career ==


=== Early bands ===
Edmunds was born in Cardiff.  As a ten year old, he first played in 1954 "
DaveMason,"David Thomas Mason (born 10 May 1946) is an English singer-songwriter and guitarist from Worcester, who first found fame with the rock band Traffic. Over the course of his career, Mason has played and recorded with many notable pop and rock musicians, including Paul McCartney, George Harrison, the Rolling Stones, Jimi Hendrix, Eric Clapton, Michael Jackson, David Crosby, Graham Nash, Steve Winwood"
DavidBowie,"The discography of English singer-songwriter David Bowie (1947–2016) consists of 27 studio albums (including nine UK number-one albums), 11 live albums, 51 compilation albums (including  two  UK  number-one albums), nine extended plays (EPs), 128 singles (including five UK number-one singles), and four soundtracks. Bowie also released 14 video albums and 72 music videos.Bowie's debut release was t"
DavidGates,"David Ashworth Gates (born December 11, 1940) is an American singer-songwriter, guitarist, musician and producer, frontman and co-lead singer (with Jimmy Griffin) of the group Bread, which reached the tops of the musical charts in Europe and North America on several occasions in the 1970s. The band was inducted into the Vocal Group Hall of Fame.


== Life and early career ==
Originally from Tulsa,"
DavidLeeRoth,"David Lee Roth (born October 10, 1954), is an American rock vocalist, musician, songwriter, actor, author, artist, and former radio personality. He is best known for his wild, energetic stage persona, and as the lead singer of hard rock band Van Halen across three stints from 1974 to 1985 and in 1996 and again from 2006 onwards. He is also known as a successful solo artist, releasing numerous RIAA"
DavidSeville,"Alvin and the Chipmunks, originally David Seville and the Chipmunks or simply the Chipmunks, are an American animated virtual band created by Ross Bagdasarian Sr. for a novelty record in 1958. The group consists of three singing animated anthropomorphic chipmunks: Alvin, the mischievous troublemaker; Simon, the tall, bespectacled intellectual; and Theodore, the chubby, shy one. The trio is managed"
DebbieGibson,"Deborah Ann Gibson (born August 31, 1970) is an American singer-songwriter, record producer, and actress. Gibson released her debut album Out of the Blue in 1987, which spawned several international hits, later being certified triple platinum by the Recording Industry Association of America. One of those singles, ""Foolish Beat"", made Gibson the youngest female artist to write, produce, and perform"
DebbyBoone,"Deborah Anne Boone (born September 22, 1956) is an American singer, author, and actress. She is best known for her 1977 hit, ""You Light Up My Life"", which spent ten weeks at No. 1 on the Billboard Hot 100 chart and led to her winning the Grammy Award for Best New Artist the following year. Boone later focused her music career on country music, resulting in the 1980 No. 1 country hit ""Are You on th"
DeepPurple,"Deep Purple are  an English rock band formed in Hertford, Hertfordshire in 1968. They are considered to be among the pioneers of heavy metal and modern hard rock, although their musical approach has changed over the years. Originally formed as a psychedelic rock and progressive rock band, they shifted to a heavier sound with their 1970 album Deep Purple in Rock. Deep Purple, together with Led Zepp"
DefLeppard,"Def Leppard are an English rock band formed in 1977 in Sheffield and are considered part of the new wave of British heavy metal movement. Since 1992, the band has consisted of Joe Elliott (lead vocals), Rick Savage (bass, backing vocals), Rick Allen (drums, backing vocals), Phil Collen (guitars, backing vocals), and Vivian Campbell (guitars, backing vocals), which has been the band's longest runni"
DenieceWilliams,"Deniece Williams (born June Deniece Chandler; June 3, 1951) is an American singer, songwriter and producer. Williams has been described as ""one of the great soul voices"" by the BBC. Williams has won four Grammys with twelve nominations altogether.


== Biography ==
June Deniece Chandler was born and raised in Gary, Indiana. She attended Morgan State University in Baltimore, Maryland, in the hopes "
DepecheMode,"Depeche Mode () are an English electronic music band formed in Basildon, Essex in 1980. The group as of now consists of a trio of Dave Gahan (lead vocals and co-songwriting), Martin Gore (keyboards, guitar, co-lead vocals and main songwriting), and Andy Fletcher (keyboards).
Depeche Mode released its debut album Speak & Spell in 1981, bringing the band onto the British new wave scene. Founding mem"
Devo,"The discography of Devo, an American new wave band formed in 1973, consists of 25 singles and 9 studio albums. Devo was founded by Gerald Casale, Bob Lewis and Mark Mothersbaugh. Devo currently consists of brothers Mark Mothersbaugh (synthesizers, lead vocals) and Bob Mothersbaugh (guitar and vocals), Gerald Casale (bass guitar, keyboards, vocals) and Josh Freese (drums). The band rose to prominen"
DionneWarwick,"Marie Dionne Warwick ( DEE-on; née Warrick; born October 12, 1940) is an American singer, actress, television host, and former United Nations Global Ambassador for the Food and Agriculture Organization and United States Ambassador of Health.
Warwick ranks among the 40 biggest hit makers of the entire rock era (1955–1999), based on the Billboard Hot 100 Pop Singles Charts. She is one of the most-ch"
DireStraits,"This page is a detailed discography of the rock band Dire Straits.


== Albums ==


=== Studio albums ===


=== Compilation albums ===


=== Live albums ===


=== Box sets ===


== Extended plays ==


== Singles ==


== Home video ==


== Music videos ==


== References =="
Divinyls,"Divinyls (stylised as diVINYLS) is the fourth studio album by Australian band Divinyls, released on 29 January 1991 by Virgin Records. The album was the band's most successful, peaking at number 5 in Australia and number 15 on the US Billboard 200. It also contains the band's biggest-selling single, ""I Touch Myself"", which reached number one in Australia, number 4 in the US and number 10 in the UK"
DobieGray,"Dobie Gray (born Lawrence Darrow Brown; July 26, 1940 – December 6, 2011) was an American singer and songwriter, whose musical career spanned soul, country, pop, and musical theater. His hit songs included ""The 'In' Crowd"" in 1965 and ""Drift Away"", which was one of the biggest hits of 1973, sold over one million copies, and remains a staple of radio airplay.


== Background ==
Gray was born in Sim"
DonHenley,"Donald Hugh Henley (born July 22, 1947) is an American musician, singer, songwriter, record producer and founding member of the Eagles. He was the drummer and co-lead vocalist for the Eagles from 1971 until the band broke up in 1980, and has reprised those duties for the group's reunions since 1994. Henley sang the lead vocals on Eagles hits such as ""Witchy Woman"", ""Desperado"", ""Best of My Love"", "
DonMcLean,"Donald McLean III (born October 2, 1945) is an American singer-songwriter, best known for his 1971 hit song ""American Pie"", an 8.5-minute folk rock ""cultural touchstone"" about the loss of innocence of the early rock and roll generation.His other hit singles include ""Vincent"", ""Dreidel"", a rendition of Roy Orbison's ""Crying"", a rendition of the Skyliners' ""Since I Don't Have You"", and ""Wonderful Ba"
DonnaSummer,"LaDonna Adrian Gaines (December 31, 1948 – May 17, 2012), widely known by her stage name based on her married name Donna Summer, was an American singer, songwriter and actress. She gained prominence during the disco era of the late 1970s and became known as the ""Queen of Disco"", while her music gained a global following.While influenced by the counterculture of the 1960s, Summer became the lead si"
DonnyOsmond,"Donald Clark Osmond (born December 9, 1957) is an American singer, dancer, actor, television host and former teen idol. Osmond first gained fame performing with four of his elder brothers as the Osmonds, earning several top ten hits and gold albums. Then, in the early 1970s, Osmond began a solo career, earning several additional top ten hits, including ""Go Away Little Girl"" (U.S. No. 1), ""Puppy Lo"
Donovan,"Donovan Philips Leitch (born 10 May 1946) is a Scottish singer, songwriter and guitarist. He developed an eclectic and distinctive style that blended folk, jazz, pop, psychedelia, and world music (notably calypso). He has lived in Scotland, Hertfordshire (England), London, California, and since at least 2008 in County Cork, Ireland, with his family. Emerging from the British folk scene, Donovan re"
DoobieBrothers,"The Doobie Brothers are an American rock band from San Jose, California. Active for five decades, with their greatest success in the 1970s, the group's current lineup consists of founding members Tom Johnston (guitars, vocals) and Patrick Simmons (guitars, vocals), veteran member Michael McDonald (keyboards, vocals), longtime member John McFee (guitars, pedal steel, violin, backing vocals), and to"
DrHook,"Dr. Hook & the Medicine Show (shortened to Dr. Hook in 1975) was an American rock band, formed in Union City, New Jersey. They enjoyed considerable commercial success in the 1970s with hit singles including ""Sylvia's Mother"", ""The Cover of 'Rolling Stone'"" (both 1972), ""Only Sixteen"" (1975), ""A Little Bit More"" (1976), ""Sharing the Night Together"" (1978), ""When You're in Love with a Beautiful Woma"
DrJohn,"Malcolm John Rebennack Jr. (November 20, 1941 – June 6, 2019), better known by his stage name Dr. John, was an American singer and songwriter. His music combined blues, pop, jazz, boogie-woogie, funk, and rock and roll.Active as a session musician from the late 1950s until his death, he gained a following in the late 1960s after the release of his album Gris-Gris and his appearance at the Bath Fes"
DuranDuran,"Duran Duran () are an English new wave band formed in Birmingham in 1978. The band were one of the most successful acts of the 1980s, but by the end of the decade, membership and music style changes challenged the band before a resurgence in the early 1990s. The group were a leading band in the MTV-driven Second British Invasion of the US in the 1980s. They achieved 14 singles in the top 10 of the"
DustySpringfield,"Mary Isabel Catherine Bernadette O'Brien  (16 April 1939 – 2 March 1999), professionally known as Dusty Springfield, was an English pop singer and record producer whose career extended from the late 1950s to the 1990s. With her distinctive mezzo-soprano sound, she was an important singer of blue-eyed soul and at her peak was one of the most successful British female performers, with six top 20 sin"
Eagles,"The Eagles are an American rock band formed in Los Angeles in 1971. The founding members were Glenn Frey (guitars, vocals), Don Henley (drums, vocals), Bernie Leadon (guitars, vocals) and Randy Meisner (bass guitar, vocals). With five number-one singles, six number-one albums, six Grammy Awards, and five American Music Awards, the Eagles were one of the most successful musical acts of the 1970s. T"
EarthWindAndFire,"Earth, Wind & Fire (abbreviated as EW&F or simply EWF) is an American band that has spanned the musical genres of R&B, soul, funk, jazz, disco, pop, rock, dance, Latin, and Afro pop. They have been described as one of the most innovative and commercially successful acts of all time. Rolling Stone called them ""innovative, precise yet sensual, calculated yet galvanizing"" and declared that the band """
Easybeats,"The Easybeats were an Australian rock band that formed in Sydney in late 1964. Considered one of the most important rock acts in Australia during the 1960s, they enjoyed a level of success that in their country rivaled the Beatles and became the first Australian rock act to score an international hit with the 1966 single ""Friday on My Mind"", as well as one of the few in Australia to exclusively wr"
EddieCochran,"Ray Edward Cochran (; October 3, 1938 – April 17, 1960) was an American rock and roll musician. Cochran's songs, such as ""Twenty Flight Rock"", ""Summertime Blues"", ""C'mon Everybody"" and ""Somethin' Else"", captured teenage frustration and desire in the mid-1950s and early 1960s. He experimented with multitrack recording, distortion techniques, and overdubbing even on his earliest singles. He played t"
EddieFloyd,"Edward Lee Floyd (born June 25, 1937) is an American soul-R&B singer and songwriter, best known for his work on the Stax record label in the 1960s and 1970s including the number 1 R&B hit song ""Knock on Wood"".


== Biography ==
Floyd was born in Montgomery, Alabama, and grew up in Detroit, Michigan. He founded The Falcons, which also featured Mack Rice. They were forerunners to future Detroit voca"
EddieGrant,"Fiction Factory were a Scottish new wave band from Perth. Formed in 1983, they are best known for their single ""(Feels Like) Heaven"", which peaked at #6 on the UK Singles Chart. The song was written by Eddie Jordan and Kevin Patterson.


== History ==
Before they began Fiction Factory, Kevin Patterson (vocals), Eddie Jordan (keyboards), Grant Taylor (trumpet) and Chic Medley (guitar) played in ski"
EddieKendricks,"Eddie James Kendrick (December 17, 1939 – October 5, 1992), known professionally as both Eddie Kendrick and Eddie Kendricks, was an American singer and songwriter. Noted for his distinctive falsetto singing style, Kendricks co-founded the Motown singing group The Temptations, and was one of their lead singers from 1960 until 1971. He was the lead voice on such famous songs as ""The Way You Do the T"
EddieMoney,"Edward Joseph Mahoney (March 21, 1949 – September 13, 2019), known professionally as Eddie Money, was an American rock singer and songwriter who had success in the 1970s and 1980s with 11 Top 40 songs including ""Baby Hold On"", ""Two Tickets to Paradise"", ""Think I'm in Love"", ""Shakin'"", ""Take Me Home Tonight"", ""I Wanna Go Back"", ""Walk on Water"", and ""The Love in Your Eyes"". Money was known as a work"
EdgarWinter,"Edgar Holland Winter (born December 28, 1946) is an American musician, songwriter, and record producer. He is known for being a multi-instrumentalist—keyboardist, guitarist, saxophonist and percussionist—as well as a singer. His success peaked in the 1970s with his band The Edgar Winter Group and their popular songs ""Frankenstein"" and ""Free Ride"".


== Early life ==
Winter was born to John Winter "
EdisonLighthouse,"Edison Lighthouse were an English pop band, formed in London in 1969. The band was best known for their 1970 hit single, ""Love Grows (Where My Rosemary Goes)"" recorded in late 1969.


== Career ==
The original line-up of Edison Lighthouse consisted of Tony Burrows (lead vocalist), Stuart Edwards (lead guitar), David Taylor (bass guitar), George Weyman (drums), and Ray Dorey (guitar). The group's T"
EdwinStarr,"Edwin Starr (born Charles Edwin Hatcher; January 21, 1942 – April 2, 2003) was an American singer and songwriter. Starr was famous for his Norman Whitfield-produced Motown singles of the 1970s, most notably the number-one hit ""War"".
Starr was born in Tennessee and raised in Ohio, and later lived in Detroit while singing for Ric-Tic and Motown Records. He was backed by the band that would become kn"
ELO,"The Electric Light Orchestra (ELO) are  an English rock band formed in Birmingham in 1970 by songwriters-multi-instrumentalists Jeff Lynne and Roy Wood with drummer Bev Bevan. Their music is characterised by a fusion of Beatlesque pop, classical arrangements and futuristic iconography. After Wood's departure in 1972, Lynne became the band's sole leader, arranging and producing every album while wr"
EltonJohm,"Melodisc Records was a record label founded by Emil E. Shalit in the late 1940s.  It was one of the first independent record labels in the UK and the parent company of the Blue Beat label.


== History ==
Melodisc records was founded by Austrian-born American citizen Emil Edward Shalit (24 December 1909 – 23 April 1983) and his business partner Jack Chilkes. Melodisc began trading in London in Aug"
ElvinBishop,"Elvin Richard Bishop (born October 21, 1942) is an American blues and rock music singer, guitarist, bandleader, and songwriter. An original member of the Paul Butterfield Blues Band, he was inducted into the Rock and Roll Hall of Fame as a member of that group in 2015 and the Blues Hall of Fame in his own right in 2016.
Bishop feels that the limitations of his voice have helped his songwriting.


"
ElvisPresley,"Elvis Aaron Presley (January 8, 1935 – August 16, 1977), also known simply as Elvis, was an American singer and actor. He is regarded as one of the most significant cultural icons of the 20th century and is often referred to as the ""King of Rock and Roll"" or simply ""the King"". His energized interpretations of songs and sexually provocative performance style, combined with a singularly potent mix o"
EmersonLakeAndPalmer,"Emerson, Lake & Palmer (ELP) were an English progressive rock supergroup formed in London in April 1970. The band consisted of keyboardist Keith Emerson; singer, bassist, guitarist and producer Greg Lake; and drummer and percussionist Carl Palmer. With nine RIAA-certified gold record albums in the US, and an estimated 48 million records sold worldwide, they were one of the most popular and commerc"
EnglandDan,"England Dan & John Ford Coley were an American soft rock duo composed of Danny Wayland ""England Dan"" Seals and John Edward ""John Ford"" Coley, active throughout the 1970s. Native Texans, they are best known for their 1976 single ""I'd Really Love to See You Tonight"", a No. 2 hit in the Billboard Hot 100 and a No. 1 Adult Contemporary hit. After they disbanded, Seals began performing as Dan Seals and"
Equals,"The Equals are a British pop, R&B and rock group  formed in North London, England in 1965.  They are best remembered for their million-selling chart-topper ""Baby, Come Back"", though they had several other chart hits in the UK and Europe. Eddy Grant founded the group with John Hall, Pat Lloyd, and brothers Derv and Lincoln Gordon, and they were noted as being ""the first major interracial rock group"
EricCarmen,"Eric Howard Carmen (born August 11, 1949) is an American singer, songwriter, guitarist and keyboardist. He scored numerous hit songs across the 1970s and 1980s, first as a member of the Raspberries (who had a million-selling single with ""Go All the Way""), and then with his solo career, including hits such as ""All by Myself"", ""Never Gonna Fall in Love Again"", ""She Did It"", ""Hungry Eyes"", and ""Make "
EricClapton,"Eric Patrick Clapton,  (born 30 March 1945) is an English rock and blues guitarist, singer, and songwriter. He is the only three-time inductee to the Rock and Roll Hall of Fame: once as a solo artist and separately as a member of the Yardbirds and of Cream. Clapton has been referred to as one of the most important and influential guitarists of all time. Clapton ranked second in Rolling Stone's lis"
Europe,"An artist is a person engaged in an activity related to creating art, practicing the arts, or demonstrating an art. The common usage in both everyday speech and academic discourse is a practitioner in the visual arts only. The term is often used in the entertainment business, especially in a business context, for musicians and other performers (less often for actors). ""Artiste"" (the French for art"
