,0
10cc,"10cc is an English rock band formed in Stockport, Greater Manchester in 1972. It initially consisted of four musicians – Graham Gouldman, Eric Stewart, Kevin Godley and Lol Creme – who had written and recorded together since 1968. The group featured two songwriting teams. Stewart and Gouldman were predominantly pop songwriters, who created most of the band's accessible songs. By contrast, Godley a"
1910FruitgumCompany,"The 1910 Fruitgum Company is an American bubblegum pop band of the 1960s.  The group's Billboard Hot 100 hits were ""Simon Says"", ""May I Take a Giant Step"", ""1, 2, 3, Red Light"", ""Goody Goody Gumdrops"", ""Indian Giver"", ""Special Delivery"", and ""The Train"".


== Career ==
The band began as Jeckell and The Hydes in New Jersey in 1966.  The original  members were Frank Jeckell, Mark Gutkowski, Floyd Ma"
2Unlimited,"2 Unlimited are a Dutch dance act founded by Belgian producers Jean-Paul De Coster and Phil Wilde in 1991 in Amsterdam, Netherlands. Dutch rapper Ray Slijngaard and Dutch vocalist Anita Doth fronted the act from 1991 to 1996. During the five years of 2 Unlimited's worldwide mainstream success, the act scored a total of 16 chart hits, including ""Get Ready for This"", ""Twilight Zone"", ""No Limit"", and"
38Special,"38 Special (sometimes stylized as .38 Special) is an American rock band that was formed by neighborhood friends Don Barnes and Donnie Van Zant in 1974 in Jacksonville, Florida, United States.


== History ==


=== 1970s ===
Donnie Van Zant, the younger brother of Lynyrd Skynyrd founder Ronnie, began playing music himself during his teen years, forming the band Standard Production in 1968, which pa"
911,"Reno 911! is an American comedy television series that initially ran on Comedy Central from 2003 to 2009. It is a mockumentary-style parody of law enforcement documentary shows, specifically Cops, with comic actors playing the police officers. Thomas Lennon, Robert Ben Garant and Kerri Kenney-Silver all starred in and are billed as creators of the series.
A revival of the series premiered on May 4"
AaronNeville,"Aaron Joseph Neville (born January 24, 1941) is an American R&B and soul vocalist and musician. He has had four platinum albums and four Top 10 hits in the United States, including three that went to #1 on Billboard's Adult Contemporary chart. His debut single, from 1966, was #1 on the Soul chart for five weeks.
He has also recorded with his brothers Art, Charles and Cyril as The Neville Brothers "
Abba,"The discography of Swedish pop music group ABBA consists of eight studio albums, two live albums, seven compilation albums, three box sets, four video albums, seventy-three singles, and thirty-three music videos. This list does not include solo material performed by individual members.
ABBA's biggest hit singles worldwide are ""Dancing Queen"" and ""Fernando"", with Arrival being their biggest hit stu"
ABC,"ABC are an English pop band that formed in Sheffield in 1980. Their classic line-up consisted of lead singer Martin Fry, guitarist and keyboardist Mark White, saxophonist Stephen Singleton and drummer David Palmer.Developed from an earlier band, Vice Versa, ABC achieved ten UK and five US Top 40 hit singles between 1981 and 1990, and their 1982 debut album, The Lexicon of Love, was a UK number-one"
ACDC,"Australian rock and roll band AC/DC, between 1975 and 2014, have released 16 studio albums (14 available worldwide and two released only in Australia), two soundtrack albums, four live albums, 11 video albums, and two box set albums. Although many AC/DC singles have been released, the band always refused to release any greatest hits-type packages; Who Made Who (which served as the soundtrack to St"
Ace,"""How Long"" is a 1975 song by the British group Ace from their album Five-A-Side. It reached No. 3 in the US and Canadian charts, and No. 20 in the UK Singles Chart.Although widely interpreted as being about adultery, the song was in fact composed by lead singer Paul Carrack upon discovering that bassist Terry Comer had been secretly working with the Sutherland Brothers and Quiver. Comer returned t"
AceOfBase,"Ace of Base is a Swedish pop group, originally consisting of siblings Jonas Berggren, Linn Berggren and Jenny Berggren, with Ulf Ekberg starting in 1990.
They achieved worldwide success following the release of their debut album Happy Nation in 1992. Later re-issued as The Sign, it was certified nine times platinum in the United States, and was the best-selling album of 1994. One of the most succe"
Aerosmith,"American rock band Aerosmith has released 15 studio albums, 6 live albums, 16 compilation albums, and 2 extended plays. Aerosmith was formed in Boston, Massachusetts in 1970 by vocalist Steven Tyler, guitarists Joe Perry and Ray Tabano, bassist Tom Hamilton, and drummer Joey Kramer. Tabano was replaced by Brad Whitford in 1971. Other than a period from 1979–1984, this lineup has remained the same."
Aha,"""Da Da Da I Don't Love You You Don't Love Me Aha Aha Aha"" (usually shortened to ""Da Da Da"") is a song by the German band Trio (sometimes stylised as TRIO). Trio was formed in 1980 by Stephan Remmler, Gert ""Kralle"" Krawinkel, and Peter Behrens. Released as a single in 1982 and featured on their 1981 eponymous debut album, ""Da Da Da"" became a hit in Germany and about 30 other countries, selling 13 m"
AirSupply,"Air Supply is a soft rock duo, consisting of English singer-songwriter and guitarist Graham Russell and Australian lead vocalist Russell Hitchcock. They had a succession of hits worldwide, including eight top-ten hits in the United States in the early 1980s. They formed in Australia in 1975 and have included various accompanying musicians and singers. The Australian Recording Industry Association "
AlannahMyles,"Alannah Myles (née Byles; born December 25, 1958) is a Canadian singer/songwriter who has won both a Grammy and a Juno Award for her recording of the song “Black Velvet”. The song was a top-ten hit in Canada and a number one hit on the U.S. Billboard Hot 100 in 1990.


== Early life ==
Myles was born Alannah Byles on Christmas Day 1958 in Toronto, Ontario. She is the daughter of William Douglas By"
AlanODay,"Alan Earle O'Day (October 3, 1940 – May 17, 2013) was an American singer-songwriter, best known for writing and singing ""Undercover Angel,"" a million-selling Gold-certified American #1 hit in 1977. He also wrote songs for several other notable performers, such as 1974's Helen Reddy #1 hit ""Angie Baby"" and the Righteous Brothers' #3 Gold hit ""Rock and Roll Heaven"". In the 1980s he moved from pop mu"
AlbertHammond,"Albert Louis Hammond OBE (born 18 May 1944 in London) is a British-Gibraltarian singer, songwriter, and record producer. A prolific songwriter, he collaborated most notably with the songwriters Mike Hazlewood, John Bettis, Diane Warren, Holly Knight and Carole Bayer Sager. Hammond's son Albert Hammond Jr. is lead guitarist for the American rock band the Strokes.
He wrote commercially successful si"
AlGreen,"Albert Leornes Greene (born April 13, 1946), often known as The Reverend Al Green, is an American singer, songwriter and record producer; he is best known for recording a series of soul hit singles in the early 1970s, including ""Take Me to the River"", ""Tired of Being Alone"", ""I'm Still in Love with You"", ""Love and Happiness"", and his signature song, ""Let's Stay Together"". After an incident in whic"
AliceCooper,"Vincent Damon Furnier (born February 4, 1948), better known by his stage name Alice Cooper, is an American singer, songwriter, and actor whose career spans over 50 years. With a raspy voice and a stage show that features numerous props, including pyrotechnics, guillotines, electric chairs, fake blood, reptiles, baby dolls, and dueling swords, Cooper is considered by music journalists and peers to "
Alive,"Left Alive is a stealth video game developed by Ilinx and published by Square Enix for Microsoft Windows and PlayStation 4. It was announced at a press conference by Sony Interactive Entertainment prior to the 2017 Tokyo Game Show.Set in the Front Mission series, the story follows several individuals trying to survive amidst a surprise invasion of one country into another, along the way helping ci"
All4One,"All-4-One is a Grammy Award-winning American male R&B and pop group best known for their hit singles ""I Swear"" and ""I Can Love You Like That"". The group comprises Jamie Jones, Delious Kennedy, Alfred Nevarez, and Tony Borowiak, all from the Antelope Valley and Mojave, California areas. The group has sold 22 million records worldwide.


== History ==
All-4-One's hit ""I Swear"" won a Grammy Award in "
AllanSherman,"Allan Sherman (born Allan Copelon; November 30, 1924 – November 20, 1973) was an American comedy writer, television producer, singer and actor who became famous as a song parodist in the early 1960s. His first album, My Son, the Folk Singer (1962), became the fastest-selling record album up to that time. His biggest hit single was ""Hello Muddah, Hello Fadduh"", a comic novelty in which a boy descri"
AllmanBrothers,"The Allman Brothers Band was an American rock band formed in Jacksonville, Florida in 1969 by brothers Duane Allman (founder, slide guitar and lead guitar) and Gregg Allman (vocals, keyboards, songwriting), as well as Dickey Betts (lead guitar, vocals, songwriting), Berry Oakley (bass guitar), Butch Trucks (drums), and Jai Johanny ""Jaimoe"" Johanson (drums). The band incorporated elements of blues,"
AlStewart,"Bed Sitter Images is the debut studio album of folk artist Al Stewart, released in 1967, and again in a revised edition with a new cover picture in 1970. The songs were orchestrated by Alexander Faris. The cover of the first 1967 edition spells ""Bed Sitter"" without a hyphen, as do many reviews and Al Stewart's official website. The album and its title track are both named on the record label as Be"
AlWilson,"An artist is a person engaged in an activity related to creating art, practicing the arts, or demonstrating an art. The common usage in both everyday speech and academic discourse is a practitioner in the visual arts only. The term is often used in the entertainment business, especially in a business context, for musicians and other performers (less often for actors). ""Artiste"" (the French for art"
Ambrosia,"Ambrosia is an American rock band formed in Los Angeles, California in 1970. Ambrosia had five top 40 hit singles released between 1975 and 1980, including the top 5 hits ""How Much I Feel"" and ""Biggest Part of Me"", and top 20 hits ""You're the Only Woman (You & I)"" and ""Holdin' on to Yesterday"". Most of the original band members have been active with the group continuously for well over 25 years to"
America,"A list by date of birth of historically recognized American fine artists known for the creation of artworks that are primarily visual in nature, including traditional media such as painting, sculpture, photography, and printmaking, as well as more recent genres, including installation art, performance art, body art, conceptual art, video art, and digital art.
For ease of use the list has been subd"
AndrewGold,"Andrew Maurice Gold (August 2, 1951 – June 3, 2011) was an American multi-instrumentalist, singer, songwriter, and record producer who influenced much of the sound of Los Angeles-dominated pop rock in the 1970s. Gold played on scores of records by other artists, most notably Linda Ronstadt's, and had his own success with the U.S. Top 40 hits ""Lonely Boy"" (1977) and ""Thank You for Being a Friend"" ("
AndrewLloydWebber,"Andrew Lloyd Webber, Baron Lloyd-Webber (born 22 March 1948) is an English composer and impresario of musical theatre. Several of his musicals have run for more than a decade both in the West End and on Broadway. He has composed 21 musicals, a song cycle, a set of variations, two film scores, and a Latin Requiem Mass. Several of his songs have been widely recorded and were successful outside of th"
AndyKim,"Andrew Youakim, performing as Andy Kim, is a Canadian pop rock singer and songwriter. He grew up in Montreal, Quebec. He is known for hits that he released in the late 1960s and 1970s: the international hit ""Baby, I Love You"" in 1969, and ""Rock Me Gently"", which topped the US singles chart in 1974. He co-wrote ""Sugar, Sugar"" in 1968 and sang on the recording as part of the Archies; it was #1 for f"
Animals,"The Animals are an English rhythm and blues and rock band, formed in Newcastle upon Tyne in the early 1960s. The band moved to London upon finding fame in 1964. The Animals were known for their gritty, bluesy sound and deep-voiced frontman Eric Burdon, as exemplified by their signature song and transatlantic No. 1 hit single, ""House of the Rising Sun"", as well as by hits such as  ""We Gotta Get Out"
Animotion,"Animotion is an American synthpop band from Los Angeles, California, best known for the songs ""Obsession"", ""Let Him Go"", ""I Engineer"", and ""Room to Move"".Formed in 1983 from the remnants of a retro science-fiction band called Red Zone, they signed a record deal with Mercury Records in 1984 and made four albums.


== History ==


=== Formation and rise (1983–1986) ===
Astrid Plane, keyboardist Paul"
AnitaBaker,"Anita Denise Baker (born January 26, 1958) is an American singer-songwriter. She is regarded as one of the most popular singers of soulful romantic ballads during the height of the quiet storm period of contemporary R&B in the 1980s. Starting her career in the late 1970s with the funk band Chapter 8, Baker released her first solo album, The Songstress, in 1983. In 1986, she rose to stardom followi"
AnitaWard,"Anita Ward (born December 20, 1956) is an American singer and musician. She is best known for her 1979 million-selling chart-topper ""Ring My Bell"".


== Career ==
Before signing a recording contract, Ward obtained a degree in psychology from Rust College in Holly Springs, Mississippi, and had become a schoolteacher. While recording her debut album, record label owner Frederick Knight presented her"
AnneMurray,"Morna Anne Murray  (born June 20, 1945) is a Canadian singer. Her albums consisting primarily of pop, country, and adult contemporary music have sold over 55 million copies worldwide during her 40-year career.Murray was the first Canadian female solo singer to reach No. 1 on the U.S. charts, and also the first to earn a Gold record for one of her signature songs, ""Snowbird"" (1970). She is often ci"
AnnieLennox,"Ann Lennox OBE (born 25 December 1954) is a Scottish singer-songwriter, political activist and philanthropist. After achieving moderate success in the late 1970s as part of the new wave band The Tourists, she and fellow musician Dave Stewart went on to achieve international success in the 1980s as Eurythmics. Appearing in the 1983 music video for “Sweet Dreams (Are Made of This)” with orange cropp"
Archies,"""Sugar, Sugar"" is a song written by Jeff Barry and Andy Kim. It was originally recorded by the cartoon band the Archies. This version reached No. 1 in the US on the Billboard Hot 100 chart in 1969 and remained there for four weeks. It was also No.1 on the UK Singles chart in that same year for eight weeks. The song became a hit again in 1970 when rhythm and blues and soul singer Wilson Pickett too"
ArethaFranklin,"This discography documents the releases of albums and singles by Aretha Franklin, who is ranked first among female vocalists with the most Billboard chart hits during the rock era (1955–2012) with a total of 88 according to Joel Whitburn's Record Research.


== Albums ==


=== Studio albums ===


=== Live albums ===


=== Soundtrack albums ===


=== Compilation albums ===


== Singles ==


=== The"
Asia,"Asia Artist Awards (abbreviated AAA) is an awards ceremony organized by South Korea-based business newspaper Money Today and its global media brands StarNews and MTN. It honors outstanding achievements and international contributions of Asian artists in television, film and music.
The inaugural ceremony was held on November 16, 2016 at Kyung Hee University's Hall of Peace in Seoul, and was broadca"
Association,"The Young Artist Award (originally known as the Youth in Film Award) is an accolade presented by the Young Artist Foundation, a nonprofit organization founded in 1978 to honor excellence of youth performers, and to provide scholarships for young artists who may be physically disabled or financially unstable.First presented in 1979, the Young Artist Awards was the first organization established to "
AtlantaRhythmSection,"Atlanta Rhythm Section (or ARS) is an American Southern rock band, formed in 1971 by Rodney Justo (singer), Barry Bailey (guitar), Paul Goddard (bass), Dean Daughtry (keyboards), Robert Nix (drums) and James B. Cobb, Jr. (guitar). The band's current lineup consists of Daughtry and Justo, along with guitarists David Anderson and Steve Stone, bassist Justin Senker and drummer Rodger Stephan.


== Ea"
AverageWhiteBand,"The Average White Band (also AWB) are a Scottish funk and R&B band that had a series of soul and disco hits between 1974 and 1980. They are best known for their million-selling instrumental track ""Pick Up the Pieces"", and their albums AWB and Cut the Cake. The band name was initially proposed by Bonnie Bramlett. They have influenced others, such as the Brand New Heavies, and been sampled by variou"
B52s,"The B-52s (styled as The B-52's prior to 2008) are an American new wave band which was formed in Athens, Georgia, in 1976. The original line-up consisted of Fred Schneider (vocals, percussion), Kate Pierson (vocals, keyboards), Cindy Wilson (vocals, percussion), Ricky Wilson (guitar), and Keith Strickland (drums, guitar, keyboards). Ricky Wilson died from AIDS-related illness in 1985, and Strickla"
Babys,"The Babys are a British rock group best known for their songs ""Isn't It Time"" and ""Every Time I Think of You"". Both songs were composed by Jack Conrad and Ray Kennedy, and each reached No. 13 on the U.S. Billboard Hot 100 and No. 8 on the Cashbox chart in the late 1970s. The original Babys line-up consisted of founding member keyboardist/guitarist Michael Corby, and, in order of joining the group,"
BachmanTurnerOverdrive,"Bachman–Turner Overdrive, often abbreviated as BTO, was a Canadian rock group from Winnipeg, Manitoba founded by Randy Bachman and Fred Turner. Their 1970s catalogue included five Top 40 albums and six US Top 40 singles (eleven in Canada). The band has sold nearly 30 million albums worldwide, and has fans affectionately known as ""gearheads"" (derived from the band's gear-shaped logo). Many of their"
BadCompany,"Bad Company are  an English hard rock supergroup formed in England, in 1973 by singer Paul Rodgers, guitarist Mick Ralphs, drummer Simon Kirke and later adding bassist Boz Burrell. Peter Grant, who managed the rock band Led Zeppelin, also managed Bad Company until 1982.
Bad Company enjoyed great success throughout the 1970s. Their first three albums, Bad Company (1974), Straight Shooter (1975), an"
BadEnglish,"Bad English was an Anglo-American hard rock/glam metal supergroup formed in 1987. It reunited Journey keyboardist Jonathan Cain with singer John Waite and bassist Ricky Phillips, his former bandmates in The Babys, along with Journey guitarist Neal Schon and drummer Deen Castronovo.


== History ==
The members decided on a name for the band while playing pool. John Waite missed a shot and Jonathan "
Badfinger,"Badfinger were  a Welsh/English rock band formed in Swansea that were active from the 1960s to the 1980s. Their best-known lineup consisted of Pete Ham, Mike Gibbins, Tom Evans, and Joey Molland. They are recognized for their influence on the 1970s power pop genre.
The band evolved from an earlier group called The Iveys, formed in 1961, which became the first group signed by the Beatles' Apple lab"
Bananarama,"Bananarama are an English female pop music vocal duo, originally formed as a trio in London in 1979 by friends Sara Dallin, Siobhan Fahey and Keren Woodward. Their success on both pop and dance charts saw them listed in the Guinness World Records for achieving the world's highest number of chart entries by an all-female group. Between 1982 and 2009, they had 28 singles reach the Top 50 of the UK S"
BarbraStreisand,"The Barbra Streisand Album is the debut album by Barbra Streisand, released February 25, 1963, on Columbia Records, catalogue CL 2007 in mono and CS 8807 in stereo. It peaked at #9 on the Billboard pop albums chart, and has been certified a gold album by the RIAA.
The album won Grammy awards for Album of the Year and Best Female Vocal Performance. In January 2006 the album was inducted into the Gr"
BarryManilow,"Barry Manilow is an American singer–songwriter, musician, arranger, producer, and conductor. His discography consists of 31 studio albums, 6 live albums, 17 compilation albums, and 57 singles. His first album, Barry Manilow, was released in 1973. He is best known for such recordings as ""Mandy"", ""Can't Smile Without You"", and ""Copacabana (At the Copa)"". To date, he has sold more than 75 million rec"
BarryMann,"This is a list of songs written by Barry Mann and Cynthia Weil, in most cases as a songwriting duo.  The pair have also collaborated with other songwriters.  Both Mann and Weil have also written chart hit songs as individuals with other writers, and Mann has written on his own.


== Chart hits and other notable songs written by Mann and Weil ==


== Chart hits and other notable songs written by Ba"
BarryWhite,"Barry Eugene Carter (September 12, 1944 – July 4, 2003), better known by his stage name Barry White, was an American singer-songwriter, musician, record producer and composer.
A two-time Grammy Award–winner known for his distinctive bass-baritone voice and romantic image, his greatest success came in the 1970s as a solo singer and with The Love Unlimited Orchestra, crafting many enduring soul, fun"
BayCityRollers,"The Bay City Rollers are a Scottish pop rock band known for their worldwide teen idol popularity in the 1970s. They have been called the ""tartan teen sensations from Edinburgh"", and ""the first of many acts heralded as the 'biggest group since the Beatles'"".The group's line-up had many changes over the years, but the classic line-up during its heyday included guitarists Eric Faulkner and Stuart Woo"
BeachBoys,"Best of the Beach Boys is the first compilation album released by American rock band the Beach Boys through Capitol Records in 1966. The first version was released in the United States on July 5, 1966, two months after Pet Sounds. Another version of Best of The Beach Boys was issued in the United Kingdom on November 11, 1966 with a track listing that differed from the American release.


== North "
Beatles,"With the Beatles is the second studio album by the English rock band the Beatles. It was released on 22 November 1963 on Parlophone, exactly eight months after the band's debut Please Please Me. Produced by George Martin, the album features eight original compositions (seven by Lennon–McCartney and ""Don't Bother Me"", George Harrison's first recorded solo composition and his first released on a Bea"
BeauBrummels,"The Beau Brummels were an American rock band. Formed in San Francisco in 1964, the band's original lineup included Sal Valentino (lead vocals), Ron Elliott (lead guitar), Ron Meagher (bass guitar), Declan Mulligan (rhythm guitar, bass, harmonica), and John Petersen (drums). They were discovered by local disc jockeys who were looking to sign acts to their new label, Autumn Records, where Sylvester "
BeeGees,"The Bee Gees 
were a music group formed in 1958. Their lineup consisted of brothers Barry, Robin, and Maurice Gibb. The trio were especially successful as a popular music act in the late 1960s and early 1970s, and later as prominent performers of the disco music era in the mid-to-late 1970s. The group sang recognisable three-part tight harmonies; Robin's clear vibrato lead vocals were a hallmark o"
BelindaCarlisle,"Belinda Jo Carlisle (born August 17, 1958) is an American singer, musician, and author. She gained worldwide fame as the lead singer of the Go-Go's, one of the most successful all-female bands in history, and went on to have a prolific career as a solo artist.
Raised in Southern California, Carlisle became the lead singer of the Go-Go's after the band's formation in 1978. With their chart-topping "
BenEKing,"Benjamin Earl King (né Nelson, September 28, 1938 – April 30, 2015) was an American soul and R&B singer and record producer. He is best known as the singer and co-composer of ""Stand by Me""—a U.S. Top 10 hit, both in 1961 and later in 1986 (when it was used as the theme to the film of the same name), a number one hit in the United Kingdom in 1987, and no. 25 on the RIAA's list of Songs of the Centu"
Berlin,"Brigid Emmett Berlin (September 6, 1939 – July 17, 2020) was an American artist and Warhol superstar.


== Early years ==
Berlin was in Manhattan in New York City. She was the eldest of three daughters born to socialite parents, Muriel (Johnson) ""Honey"" Berlin and Richard E. Berlin. Her father was chairman of the Hearst media empire for 32 years.As a child, Berlin regularly mixed with celebrities "
BertieHiggins,"Elbert Joseph ""Bertie"" Higgins (born December 8, 1944) is an American singer-songwriter. In 1982, Higgins had a top 40 album with Just Another Day in Paradise. It spawned the hit song ""Key Largo"", which referenced the Humphrey Bogart film of the same name and reached No. 8 on the U.S. Billboard Hot 100, No. 1 on the Billboard Adult Contemporary chart and No. 50 on the Billboard Country chart. In 2"
